{
  "$schema": "http://json-schema.org/draft-07/schema#",
  "title": "LoRA catalog entry",
  "type": "object",
  "additionalProperties": false,
  "required": ["model_name", "base_models", "description", "use_when", "status"],
  "properties": {
    "model_name": { "type": "string", "pattern": "^[A-Za-z0-9][A-Za-z0-9._-]*/[A-Za-z0-9][A-Za-z0-9._-]*$" },
    "weight_name": { "type": "string", "pattern": "\\.safetensors$" },
    "revision": { "type": "string", "minLength": 1 },
    "base_models": {
      "type": "array", "minItems": 1, "uniqueItems": true,
      "items": { "type": "string", "pattern": "^[A-Za-z0-9][A-Za-z0-9._-]*/[A-Za-z0-9][A-Za-z0-9._-]*$" }
    },
    "workflow": {
      "oneOf": [
        { "type": "null" },
        { "enum": ["t2va", "fl2va", "ref2va"] },
        {
          "type": "array", "minItems": 1, "uniqueItems": true,
          "items": { "enum": ["t2va", "fl2va", "ref2va"] }
        }
      ]
    },
    "description": { "type": "string", "minLength": 1 },
    "use_when": { "type": "string", "minLength": 1 },
    "trigger": { "type": "string" },
    "scale": {
      "type": "object", "additionalProperties": false, "required": ["default"],
      "properties": {
        "default": { "type": "number" },
        "range": { "type": "array", "items": { "type": "number" }, "minItems": 2, "maxItems": 2 }
      }
    },
    "stacks_with": { "type": "array", "items": { "type": "string" } },
    "status": { "enum": ["proven", "trial", "rejected"] },
    "evidence": {
      "type": "array",
      "items": {
        "type": "object", "additionalProperties": false, "required": ["note"],
        "properties": {
          "job": { "type": "string" },
          "issue": { "type": "integer" },
          "note": { "type": "string", "minLength": 1 }
        }
      }
    },
    "license": { "type": "string" },
    "tags": { "type": "array", "items": { "type": "string" } }
  },
  "allOf": [
    {
      "if": { "properties": { "status": { "enum": ["proven", "rejected"] } } },
      "then": { "required": ["evidence"], "properties": { "evidence": { "minItems": 1 } } }
    }
  ]
}
