{
  "model_name": "InstantX/MiniMax-H3-Turbo-Lora-Diffusers",
  "weight_name": "minimax_h3_turbo_4step_ckpt500_diffusers.safetensors",
  "revision": "d290a021e3c927b9396f3d20fc8de4a567c603dd",
  "base_models": [
    "MiniMaxAI/MiniMax-H3"
  ],
  "workflow": [
    "t2va",
    "fl2va"
  ],
  "description": "larryvrh's 4-step turbo in native diffusers format (transformer.-prefixed, adaln and norm_out included). num_inference_steps 5 (4 evaluations). The card calls it an under-trained prototype; an alternative to the proven lightx2v turbo-4step-keyframe, not a replacement. Needs the unpruned transformer",
  "use_when": "A 4-step keyframe render, as an alternative to turbo-4step-keyframe",
  "scale": {
    "default": 1.0
  },
  "status": "trial",
  "license": "apache-2.0",
  "tags": [
    "speed",
    "turbo",
    "distill"
  ],
  "evidence": [
    {
      "note": "960x544x124, shift 12/3 (the card's), steps 5, lora_alpha unset, sage_hub: 13.6 s/step; loads correctly (mixed rank 64/16, diffusers mirrors ranks into alphas - a stated lora_alpha would mis-scale its rank-16 AdaLN). Eagle beat smeared and a flatter audio envelope next to turbo-4step-keyframe on the same prompt and seed",
      "job": "4102bd97eb1b"
    }
  ]
}
